elementName|attributeName|fsharpAttributeName|types|felizAttr|url|desc
a|download|download|string|{"name":"download","types":["Boolean","String"]}|https://developer.mozilla.org/en-US/docs/Web/HTML/Element/a|Causes the browser to treat the linked URL as a dow
a|href|href|string|{"name":"href","types":["String"]}|https://developer.mozilla.org/en-US/docs/Web/HTML/Element/a|The URL that the hyperlink points to. Links are not
a|hreflang|hreflang|System.String|{"name":"hrefLang","types":["String"]}|https://developer.mozilla.org/en-US/docs/Web/HTML/Element/a|Hints at the human language of the linked URL. No b
a|ping|ping|System.String|{"name":"ping","types":["String","f"]}|https://developer.mozilla.org/en-US/docs/Web/HTML/Element/a|A space-separated list of URLs. When the link is fo
a|referrerpolicy|referrerpolicy|string|null|https://developer.mozilla.org/en-US/docs/Web/HTML/Element/a|How much of the referrer to send when following the
a|rel|rel|System.String|{"name":"rel","types":["String"]}|https://developer.mozilla.org/en-US/docs/Web/HTML/Element/a|The relationship of the linked URL as space-separat
a|target|target|string|{"name":"target","types":["String"]}|https://developer.mozilla.org/en-US/docs/Web/HTML/Element/a|Where to display the linked URL, as the name for a 
a|type|type'|System.String|null|https://developer.mozilla.org/en-US/docs/Web/HTML/Element/a|Hints at the linked URL's format with a MIME type. 
area|alt|alt|System.String|{"name":"alt","types":["String"]}|https://developer.mozilla.org/en-US/docs/Web/HTML/Element/area|A text string alternative to display on browsers th
area|coords|coords|string|null|https://developer.mozilla.org/en-US/docs/Web/HTML/Element/area|The coords attribute details the coordinates of the
area|download|download|System.String|{"name":"download","types":["Boolean","String"]}|https://developer.mozilla.org/en-US/docs/Web/HTML/Element/area|This attribute, if present, indicates that the auth
area|href|href|System.String|{"name":"href","types":["String"]}|https://developer.mozilla.org/en-US/docs/Web/HTML/Element/area|The hyperlink target for the area. Its value is a v
area|hreflang|hreflang|System.String|{"name":"hrefLang","types":["String"]}|https://developer.mozilla.org/en-US/docs/Web/HTML/Element/area|Indicates the language of the linked resource. Allo
area|ping|ping|System.String|{"name":"ping","types":["String","f"]}|https://developer.mozilla.org/en-US/docs/Web/HTML/Element/area|Contains a space-separated list of URLs to which, w
area|referrerpolicy|referrerpolicy|string|null|https://developer.mozilla.org/en-US/docs/Web/HTML/Element/area|A string indicating which referrer to use when fetc
area|rel|rel|System.String|{"name":"rel","types":["String"]}|https://developer.mozilla.org/en-US/docs/Web/HTML/Element/area|For anchors containing the href attribute, this att
area|shape|shape|System.String|null|https://developer.mozilla.org/en-US/docs/Web/HTML/Element/area|The shape of the associated hot spot. The specifica
area|target|target|string|{"name":"target","types":["String"]}|https://developer.mozilla.org/en-US/docs/Web/HTML/Element/area|A keyword or author-defined name of the browsing co
audio|autoplay|autoplay|System.String|{"name":"autoPlay","types":["Boolean"]}|https://developer.mozilla.org/en-US/docs/Web/HTML/Element/audio|A Boolean attribute: if specified, the audio will a
audio|controls|controls|System.String|{"name":"controls","types":["Boolean"]}|https://developer.mozilla.org/en-US/docs/Web/HTML/Element/audio|If this attribute is present, the browser will offe
audio|controlslist|controlslist|System.String|null|https://developer.mozilla.org/en-US/docs/Web/HTML/Element/audio|The controlslist attribute, when specified, helps t
audio|crossorigin|crossorigin|string|null|https://developer.mozilla.org/en-US/docs/Web/HTML/Element/audio|This enumerated attribute indicates whether to use 
audio|disableremoteplayback|disableremoteplayback|System.String|null|https://developer.mozilla.org/en-US/docs/Web/HTML/Element/audio|A Boolean attribute used to disable the capability 
audio|loop|loop|System.String|{"name":"loop","types":["Boolean"]}|https://developer.mozilla.org/en-US/docs/Web/HTML/Element/audio|A Boolean attribute: if specified, the audio player
audio|muted|muted|System.String|{"name":"muted","types":["Boolean"]}|https://developer.mozilla.org/en-US/docs/Web/HTML/Element/audio|A Boolean attribute that indicates whether the audi
audio|preload|preload|string|null|https://developer.mozilla.org/en-US/docs/Web/HTML/Element/audio|This enumerated attribute is intended to provide a 
audio|src|src|System.String|{"name":"src","types":["String"]}|https://developer.mozilla.org/en-US/docs/Web/HTML/Element/audio|The URL of the audio to embed. This is subject to H
base|href|href|System.String|{"name":"href","types":["String"]}|https://developer.mozilla.org/en-US/docs/Web/HTML/Element/base|The base URL to be used throughout the document for
base|target|target|string|{"name":"target","types":["String"]}|https://developer.mozilla.org/en-US/docs/Web/HTML/Element/base|A keyword or author-defined name of the default bro
bdo|dir|dir|string|null|https://developer.mozilla.org/en-US/docs/Web/HTML/Element/bdo|The direction in which text should be rendered in t
blockquote|cite|cite|System.String|{"name":"cite","types":["String"]}|https://developer.mozilla.org/en-US/docs/Web/HTML/Element/blockquote|A URL that designates a source document or message 
body|alink|alink|System.String|null|https://developer.mozilla.org/en-US/docs/Web/HTML/Element/body|Color of text for hyperlinks when selected. Do not 
body|background|background|System.String|null|https://developer.mozilla.org/en-US/docs/Web/HTML/Element/body|URI of an image to use as a background. Do not use 
body|bgcolor|bgcolor|System.String|null|https://developer.mozilla.org/en-US/docs/Web/HTML/Element/body|Background color for the document. Do not use this 
body|bottommargin|bottommargin|System.String|null|https://developer.mozilla.org/en-US/docs/Web/HTML/Element/body|The margin of the bottom of the body. Do not use th
body|leftmargin|leftmargin|System.String|null|https://developer.mozilla.org/en-US/docs/Web/HTML/Element/body|The margin of the left of the body. Do not use this
body|link|link|System.String|null|https://developer.mozilla.org/en-US/docs/Web/HTML/Element/body|Color of text for unvisited hypertext links. Do not
body|onafterprint|onafterprint|System.String|null|https://developer.mozilla.org/en-US/docs/Web/HTML/Element/body|Function to call after the user has printed the doc
body|onbeforeprint|onbeforeprint|System.String|null|https://developer.mozilla.org/en-US/docs/Web/HTML/Element/body|Function to call when the user requests printing of
body|onbeforeunload|onbeforeunload|System.String|null|https://developer.mozilla.org/en-US/docs/Web/HTML/Element/body|Function to call when the document is about to be u
body|onblur|onblur|System.String|{"name":"onBlur","types":["FSharpFunc\u00602"]}|https://developer.mozilla.org/en-US/docs/Web/HTML/Element/body|Function to call when the document loses focus.Func
body|onerror|onerror|System.String|{"name":"onError","types":["FSharpFunc\u00602","FSharpFunc\u00602"]}|https://developer.mozilla.org/en-US/docs/Web/HTML/Element/body|Function to call when the document fails to load pr
body|onfocus|onfocus|System.String|{"name":"onFocus","types":["FSharpFunc\u00602"]}|https://developer.mozilla.org/en-US/docs/Web/HTML/Element/body|Function to call when the document receives focus.F
body|onhashchange|onhashchange|System.String|null|https://developer.mozilla.org/en-US/docs/Web/HTML/Element/body|Function to call when the fragment identifier part 
body|onlanguagechange|onlanguagechange|System.String|null|https://developer.mozilla.org/en-US/docs/Web/HTML/Element/body|Function to call when the preferred languages chang
body|onload|onload|System.String|{"name":"onLoad","types":["FSharpFunc\u00602"]}|https://developer.mozilla.org/en-US/docs/Web/HTML/Element/body|Function to call when the document has finished loa
body|onmessage|onmessage|System.String|null|https://developer.mozilla.org/en-US/docs/Web/HTML/Element/body|Function to call when the document has received a m
body|onoffline|onoffline|System.String|null|https://developer.mozilla.org/en-US/docs/Web/HTML/Element/body|Function to call when network communication has fai
body|ononline|ononline|System.String|null|https://developer.mozilla.org/en-US/docs/Web/HTML/Element/body|Function to call when network communication has bee
body|onpopstate|onpopstate|System.String|null|https://developer.mozilla.org/en-US/docs/Web/HTML/Element/body|Function to call when the user has navigated sessio
body|onredo|onredo|System.String|null|https://developer.mozilla.org/en-US/docs/Web/HTML/Element/body|Function to call when the user has moved forward in
body|onresize|onresize|System.String|{"name":"onResize","types":["FSharpFunc\u00602"]}|https://developer.mozilla.org/en-US/docs/Web/HTML/Element/body|Function to call when the document has been resized
body|onstorage|onstorage|System.String|null|https://developer.mozilla.org/en-US/docs/Web/HTML/Element/body|Function to call when the storage area has changed.
body|onundo|onundo|System.String|null|https://developer.mozilla.org/en-US/docs/Web/HTML/Element/body|Function to call when the user has moved backward i
body|onunload|onunload|System.String|null|https://developer.mozilla.org/en-US/docs/Web/HTML/Element/body|Function to call when the document is going away.Fu
body|rightmargin|rightmargin|System.String|null|https://developer.mozilla.org/en-US/docs/Web/HTML/Element/body|The margin of the right of the body. Do not use thi
body|text|text|System.String|{"name":"text","types":["Double","Int32","String"]}|https://developer.mozilla.org/en-US/docs/Web/HTML/Element/body|Foreground color of text. Do not use this attribute
body|topmargin|topmargin|System.String|null|https://developer.mozilla.org/en-US/docs/Web/HTML/Element/body|The margin of the top of the body. Do not use this 
body|vlink|vlink|System.String|null|https://developer.mozilla.org/en-US/docs/Web/HTML/Element/body|Color of text for visited hypertext links. Do not u
button|autocomplete|autocomplete|System.String|{"name":"autoComplete","types":["String"]}|https://developer.mozilla.org/en-US/docs/Web/HTML/Element/button|This attribute on a <button> is nonstandard and Fir
button|autofocus|autofocus|System.String|{"name":"autoFocus","types":["Boolean"]}|https://developer.mozilla.org/en-US/docs/Web/HTML/Element/button|This Boolean attribute specifies that the button sh
button|disabled|disabled|System.String|{"name":"disabled","types":["Boolean"]}|https://developer.mozilla.org/en-US/docs/Web/HTML/Element/button|This Boolean attribute prevents the user from inter
button|form|form|System.String|{"name":"form","types":["String"]}|https://developer.mozilla.org/en-US/docs/Web/HTML/Element/button|The <form> element to associate the button with (it
button|formaction|formaction|System.String|null|https://developer.mozilla.org/en-US/docs/Web/HTML/Element/button|The URL that processes the information submitted by
button|formenctype|formenctype|string|null|https://developer.mozilla.org/en-US/docs/Web/HTML/Element/button|If the button is a submit button (it's inside/assoc
button|formmethod|formmethod|string|null|https://developer.mozilla.org/en-US/docs/Web/HTML/Element/button|If the button is a submit button (it's inside/assoc
button|formnovalidate|formnovalidate|System.String|null|https://developer.mozilla.org/en-US/docs/Web/HTML/Element/button|If the button is a submit button, this Boolean attr
button|formtarget|formtarget|string|null|https://developer.mozilla.org/en-US/docs/Web/HTML/Element/button|If the button is a submit button, this attribute is
button|name|name|System.String|{"name":"name","types":["String"]}|https://developer.mozilla.org/en-US/docs/Web/HTML/Element/button|The name of the button, submitted as a pair with th
button|type|type'|string|null|https://developer.mozilla.org/en-US/docs/Web/HTML/Element/button|The default behavior of the button. Possible values
button|value|value|System.String|{"name":"value","types":["Boolean","Double","Guid","Int32","String","IEnumerable\u00601","IEnumerable\u00601","IEnumerable\u00601","DateTime"]}|https://developer.mozilla.org/en-US/docs/Web/HTML/Element/button|Defines the value associated with the button's name
canvas|height|height|System.String|{"name":"height","types":["Double","ICssUnit","Int32"]}|https://developer.mozilla.org/en-US/docs/Web/HTML/Element/canvas|The height of the coordinate space in CSS pixels. D
canvas|moz-opaque|mozOpaque|System.String|null|https://developer.mozilla.org/en-US/docs/Web/HTML/Element/canvas|Lets the canvas know whether translucency will be a
canvas|width|width|System.String|{"name":"width","types":["Double","ICssUnit","Int32"]}|https://developer.mozilla.org/en-US/docs/Web/HTML/Element/canvas|The width of the coordinate space in CSS pixels. De
col|span|span|System.String|{"name":"span","types":["Int32"]}|https://developer.mozilla.org/en-US/docs/Web/HTML/Element/col|This attribute contains a positive integer indicati
colgroup|span|span|System.String|{"name":"span","types":["Int32"]}|https://developer.mozilla.org/en-US/docs/Web/HTML/Element/colgroup|This attribute contains a positive integer indicati
data|value|value|System.String|{"name":"value","types":["Boolean","Double","Guid","Int32","String","IEnumerable\u00601","IEnumerable\u00601","IEnumerable\u00601","DateTime"]}|https://developer.mozilla.org/en-US/docs/Web/HTML/Element/data|This attribute specifies the machine-readable trans
dd|nowrap|nowrap|System.String|null|https://developer.mozilla.org/en-US/docs/Web/HTML/Element/dd|If the value of this attribute is set to yes, the d
del|cite|cite|System.String|{"name":"cite","types":["String"]}|https://developer.mozilla.org/en-US/docs/Web/HTML/Element/del|A URI for a resource that explains the change (for 
del|datetime|datetime|System.String|{"name":"dateTime","types":["String"]}|https://developer.mozilla.org/en-US/docs/Web/HTML/Element/del|This attribute indicates the time and date of the c
details|open|open'|System.String|null|https://developer.mozilla.org/en-US/docs/Web/HTML/Element/details|This Boolean attribute indicates whether the detail
dialog|open|open'|System.String|null|https://developer.mozilla.org/en-US/docs/Web/HTML/Element/dialog|Indicates that the dialog is active and can be inte
embed|height|height|System.String|{"name":"height","types":["Double","ICssUnit","Int32"]}|https://developer.mozilla.org/en-US/docs/Web/HTML/Element/embed|The displayed height of the resource, in CSS pixels
embed|src|src|System.String|{"name":"src","types":["String"]}|https://developer.mozilla.org/en-US/docs/Web/HTML/Element/embed|The URL of the resource being embedded.The URL of t
embed|type|type'|System.String|null|https://developer.mozilla.org/en-US/docs/Web/HTML/Element/embed|The MIME type to use to select the plug-in to insta
embed|width|width|System.String|{"name":"width","types":["Double","ICssUnit","Int32"]}|https://developer.mozilla.org/en-US/docs/Web/HTML/Element/embed|The displayed width of the resource, in CSS pixels.
fieldset|disabled|disabled|System.String|{"name":"disabled","types":["Boolean"]}|https://developer.mozilla.org/en-US/docs/Web/HTML/Element/fieldset|If this Boolean attribute is set, all form controls
fieldset|form|form|System.String|{"name":"form","types":["String"]}|https://developer.mozilla.org/en-US/docs/Web/HTML/Element/fieldset|This attribute takes the value of the id attribute 
fieldset|name|name|System.String|{"name":"name","types":["String"]}|https://developer.mozilla.org/en-US/docs/Web/HTML/Element/fieldset|The name associated with the group.The name associa
form|accept|accept|System.String|{"name":"accept","types":["String"]}|https://developer.mozilla.org/en-US/docs/Web/HTML/Element/form|Comma-separated content types the server accepts.Co
form|accept-charset|acceptCharset|System.String|null|https://developer.mozilla.org/en-US/docs/Web/HTML/Element/form|Space-separated character encodings the server acce
form|autocapitalize|autocapitalize|string|null|https://developer.mozilla.org/en-US/docs/Web/HTML/Element/form|A nonstandard attribute used by iOS Safari that con
form|autocomplete|autocomplete|string|{"name":"autoComplete","types":["String"]}|https://developer.mozilla.org/en-US/docs/Web/HTML/Element/form|Indicates whether input elements can by default hav
form|name|name|System.String|{"name":"name","types":["String"]}|https://developer.mozilla.org/en-US/docs/Web/HTML/Element/form|The name of the form. The value must not be the emp
form|rel|rel|System.String|{"name":"rel","types":["String"]}|https://developer.mozilla.org/en-US/docs/Web/HTML/Element/form|Controls the annotations and what kinds of links th
head|profile|profile|System.String|null|https://developer.mozilla.org/en-US/docs/Web/HTML/Element/head|The URIs of one or more metadata profiles, separate
hr|align|align|System.String|null|https://developer.mozilla.org/en-US/docs/Web/HTML/Element/hr|Sets the alignment of the rule on the page. If no v
hr|color|color|System.String|null|https://developer.mozilla.org/en-US/docs/Web/HTML/Element/hr|Sets the color of the rule through color name or he
hr|noshade|noshade|System.String|null|https://developer.mozilla.org/en-US/docs/Web/HTML/Element/hr|Sets the rule to have no shading.Sets the rule to h
hr|size|size|System.String|{"name":"size","types":["Int32"]}|https://developer.mozilla.org/en-US/docs/Web/HTML/Element/hr|Sets the height, in pixels, of the rule.Sets the he
hr|width|width|System.String|{"name":"width","types":["Double","ICssUnit","Int32"]}|https://developer.mozilla.org/en-US/docs/Web/HTML/Element/hr|Sets the length of the rule on the page through a p
html|manifest|manifest|System.String|null|https://developer.mozilla.org/en-US/docs/Web/HTML/Element/html|Specifies the URI of a resource manifest indicating
html|version|version|System.String|null|https://developer.mozilla.org/en-US/docs/Web/HTML/Element/html|Specifies the version of the HTML Document Type Def
html|xmlns|xmlns|System.String|{"name":"xmlns","types":["String"]}|https://developer.mozilla.org/en-US/docs/Web/HTML/Element/html|Specifies the XMLNamespace of the document. Default
iframe|allow|allow|System.String|null|https://developer.mozilla.org/en-US/docs/Web/HTML/Element/iframe|Specifies a Permissions Policy for the <iframe>. Th
iframe|allowfullscreen|allowfullscreen|System.String|null|https://developer.mozilla.org/en-US/docs/Web/HTML/Element/iframe|Set to true if the <iframe> can activate fullscreen
iframe|allowpaymentrequest|allowpaymentrequest|System.String|null|https://developer.mozilla.org/en-US/docs/Web/HTML/Element/iframe|Set to true if a cross-origin <iframe> should be al
iframe|credentialless|credentialless|System.String|null|https://developer.mozilla.org/en-US/docs/Web/HTML/Element/iframe|Set to true to make the <iframe> credentialless, me
iframe|csp|csp|System.String|null|https://developer.mozilla.org/en-US/docs/Web/HTML/Element/iframe|A Content Security Policy enforced for the embedded
iframe|fetchpriority|fetchpriority|string|null|https://developer.mozilla.org/en-US/docs/Web/HTML/Element/iframe|Provides a hint of the relative priority to use whe
iframe|height|height|System.String|{"name":"height","types":["Double","ICssUnit","Int32"]}|https://developer.mozilla.org/en-US/docs/Web/HTML/Element/iframe|The height of the frame in CSS pixels. Default is 1
iframe|loading|loading|string|null|https://developer.mozilla.org/en-US/docs/Web/HTML/Element/iframe|Indicates how the browser should load the iframe:In
iframe|name|name|System.String|{"name":"name","types":["String"]}|https://developer.mozilla.org/en-US/docs/Web/HTML/Element/iframe|A targetable name for the embedded browsing context
iframe|referrerpolicy|referrerpolicy|string|null|https://developer.mozilla.org/en-US/docs/Web/HTML/Element/iframe|Indicates which referrer to send when fetching the 
iframe|sandbox|sandbox|string|{"name":"sandbox","types":["c"]}|https://developer.mozilla.org/en-US/docs/Web/HTML/Element/iframe|Applies extra restrictions to the content in the fr
iframe|src|src|System.String|{"name":"src","types":["String"]}|https://developer.mozilla.org/en-US/docs/Web/HTML/Element/iframe|The URL of the page to embed. Use a value of about:
iframe|srcdoc|srcdoc|System.String|null|https://developer.mozilla.org/en-US/docs/Web/HTML/Element/iframe|Inline HTML to embed, overriding the src attribute.
iframe|width|width|System.String|{"name":"width","types":["Double","ICssUnit","Int32"]}|https://developer.mozilla.org/en-US/docs/Web/HTML/Element/iframe|The width of the frame in CSS pixels. Default is 30
img|alt|alt|System.String|{"name":"alt","types":["String"]}|https://developer.mozilla.org/en-US/docs/Web/HTML/Element/img|Defines an alternative text description of the imag
img|crossorigin|crossorigin|string|null|https://developer.mozilla.org/en-US/docs/Web/HTML/Element/img|Indicates if the fetching of the image must be done
img|decoding|decoding|string|null|https://developer.mozilla.org/en-US/docs/Web/HTML/Element/img|Provides an image decoding hint to the browser. All
img|fetchpriority|fetchpriority|string|null|https://developer.mozilla.org/en-US/docs/Web/HTML/Element/img|Provides a hint of the relative priority to use whe
img|height|height|System.String|{"name":"height","types":["Double","ICssUnit","Int32"]}|https://developer.mozilla.org/en-US/docs/Web/HTML/Element/img|The intrinsic height of the image, in pixels. Must 
img|ismap|ismap|System.String|null|https://developer.mozilla.org/en-US/docs/Web/HTML/Element/img|This Boolean attribute indicates that the image is 
img|loading|loading|string|null|https://developer.mozilla.org/en-US/docs/Web/HTML/Element/img|Indicates how the browser should load the image:Ind
img|referrerpolicy|referrerpolicy|string|null|https://developer.mozilla.org/en-US/docs/Web/HTML/Element/img|A string indicating which referrer to use when fetc
img|sizes|sizes|System.String|{"name":"sizes","types":["String"]}|https://developer.mozilla.org/en-US/docs/Web/HTML/Element/img|One or more strings separated by commas, indicating
img|src|src|System.String|{"name":"src","types":["String"]}|https://developer.mozilla.org/en-US/docs/Web/HTML/Element/img|The image URL. Mandatory for the <img> element. On 
img|srcset|srcset|System.String|{"name":"srcset","types":["String"]}|https://developer.mozilla.org/en-US/docs/Web/HTML/Element/img|One or more strings separated by commas, indicating
img|usemap|usemap|System.String|{"name":"usemap","types":["String"]}|https://developer.mozilla.org/en-US/docs/Web/HTML/Element/img|The partial URL (starting with #) of an image map a
img|width|width|System.String|{"name":"width","types":["Double","ICssUnit","Int32"]}|https://developer.mozilla.org/en-US/docs/Web/HTML/Element/img|The intrinsic width of the image in pixels. Must be
ins|cite|cite|System.String|{"name":"cite","types":["String"]}|https://developer.mozilla.org/en-US/docs/Web/HTML/Element/ins|This attribute defines the URI of a resource that e
ins|datetime|datetime|System.String|{"name":"dateTime","types":["String"]}|https://developer.mozilla.org/en-US/docs/Web/HTML/Element/ins|This attribute indicates the time and date of the c
label|for|for'|System.String|null|https://developer.mozilla.org/en-US/docs/Web/HTML/Element/label|The value of the for attribute must be a single id 
li|type|type'|string|null|https://developer.mozilla.org/en-US/docs/Web/HTML/Element/li|This character attribute indicates the numbering ty
li|value|value|System.String|{"name":"value","types":["Boolean","Double","Guid","Int32","String","IEnumerable\u00601","IEnumerable\u00601","IEnumerable\u00601","DateTime"]}|https://developer.mozilla.org/en-US/docs/Web/HTML/Element/li|This integer attribute indicates the current ordina
link|as|as'|System.String|null|https://developer.mozilla.org/en-US/docs/Web/HTML/Element/link|This attribute is only used when rel="preload" or r
link|blocking|blocking|string|null|https://developer.mozilla.org/en-US/docs/Web/HTML/Element/link|This attribute explicitly indicates that certain op
link|crossorigin|crossorigin|string|null|https://developer.mozilla.org/en-US/docs/Web/HTML/Element/link|This enumerated attribute indicates whether CORS mu
link|disabled|disabled|System.String|{"name":"disabled","types":["Boolean"]}|https://developer.mozilla.org/en-US/docs/Web/HTML/Element/link|For rel="stylesheet" only, the disabled Boolean att
link|fetchpriority|fetchpriority|string|null|https://developer.mozilla.org/en-US/docs/Web/HTML/Element/link|Provides a hint of the relative priority to use whe
link|href|href|System.String|{"name":"href","types":["String"]}|https://developer.mozilla.org/en-US/docs/Web/HTML/Element/link|This attribute specifies the URL of the linked reso
link|hreflang|hreflang|System.String|{"name":"hrefLang","types":["String"]}|https://developer.mozilla.org/en-US/docs/Web/HTML/Element/link|This attribute indicates the language of the linked
link|imagesizes|imagesizes|System.String|null|https://developer.mozilla.org/en-US/docs/Web/HTML/Element/link|For rel="preload" and as="image" only, the imagesiz
link|imagesrcset|imagesrcset|System.String|null|https://developer.mozilla.org/en-US/docs/Web/HTML/Element/link|For rel="preload" and as="image" only, the imagesrc
link|integrity|integrity|System.String|{"name":"integrity","types":["String"]}|https://developer.mozilla.org/en-US/docs/Web/HTML/Element/link|Contains inline metadata — a base64-encoded cryptog
link|media|media|System.String|{"name":"media","types":["String"]}|https://developer.mozilla.org/en-US/docs/Web/HTML/Element/link|This attribute specifies the media that the linked 
link|prefetch|prefetch|System.String|null|https://developer.mozilla.org/en-US/docs/Web/HTML/Element/link|Identifies a resource that might be required by the
